{
  "schema_version": "1.0",
  "generated_at": "2026-07-07T18:17:49.146552+00:00",
  "summary": "A scam call detected in Jamtara is linked to a round-tripping cycle fraud ring and two layering chain fraud rings, all active in Jamtara. A counterfeit ₹500 note was also seized in Jamtara, which is connected to the same scam call and the three fraud rings. The signals suggest a significant fraudulent activity in Jamtara.",
  "threat_level": "critical",
  "linked_signals": [
    {
      "type": "scam",
      "ref_event_id": "scam_0001",
      "reason": "scam call originates in Jamtara, where ring_09 (round-tripping cycle) is active"
    },
    {
      "type": "fraud_ring",
      "ref_event_id": "ring_09",
      "reason": "ring active in Jamtara, matching scam call origin"
    },
    {
      "type": "scam",
      "ref_event_id": "scam_0001",
      "reason": "scam call originates in Jamtara, where ring_11 (layering chain) is active"
    },
    {
      "type": "fraud_ring",
      "ref_event_id": "ring_11",
      "reason": "ring active in Jamtara, matching scam call origin"
    },
    {
      "type": "scam",
      "ref_event_id": "scam_0001",
      "reason": "scam call originates in Jamtara, where ring_12 (layering chain) is active"
    },
    {
      "type": "fraud_ring",
      "ref_event_id": "ring_12",
      "reason": "ring active in Jamtara, matching scam call origin"
    },
    {
      "type": "counterfeit",
      "ref_event_id": "note_0001",
      "reason": "counterfeit seizure linked to scam call: both in Jamtara, 0.9 km apart, within the same time window"
    },
    {
      "type": "counterfeit",
      "ref_event_id": "note_0001",
      "reason": "counterfeit note seized in Jamtara, where ring_09 is active"
    },
    {
      "type": "counterfeit",
      "ref_event_id": "note_0001",
      "reason": "counterfeit note seized in Jamtara, where ring_11 is active"
    },
    {
      "type": "counterfeit",
      "ref_event_id": "note_0001",
      "reason": "counterfeit note seized in Jamtara, where ring_12 is active"
    }
  ],
  "correlation_basis": [
    "geospatial_overlap",
    "shared_district",
    "temporal_proximity"
  ],
  "recommended_actions": [
    "Freeze accounts linked to the scam call and fraud rings in Jamtara",
    "Alert bank branches in Jamtara about the counterfeit ₹500 note",
    "Notify the telecom provider about the scam call",
    "Escalate the case to the cybercrime cell for further investigation"
  ],
  "map_hotspots": [
    {
      "type": "scam",
      "district": "Jamtara",
      "lat": 23.795,
      "lon": 86.803,
      "weight": 0.97
    },
    {
      "type": "counterfeit",
      "district": "Jamtara",
      "lat": 23.79,
      "lon": 86.81,
      "weight": 0.91
    },
    {
      "type": "fraud_ring",
      "district": "Bharatpur",
      "lat": 27.22,
      "lon": 77.49,
      "weight": 0.9997
    },
    {
      "type": "fraud_ring",
      "district": "Alwar",
      "lat": 27.55,
      "lon": 76.63,
      "weight": 0.9995
    },
    {
      "type": "fraud_ring",
      "district": "Alwar",
      "lat": 27.55,
      "lon": 76.63,
      "weight": 0.9892
    },
    {
      "type": "fraud_ring",
      "district": "Alwar",
      "lat": 27.55,
      "lon": 76.63,
      "weight": 0.9995
    },
    {
      "type": "fraud_ring",
      "district": "Alwar",
      "lat": 27.55,
      "lon": 76.63,
      "weight": 0.9998
    },
    {
      "type": "fraud_ring",
      "district": "Alwar",
      "lat": 27.55,
      "lon": 76.63,
      "weight": 0.9991
    },
    {
      "type": "fraud_ring",
      "district": "Bharatpur",
      "lat": 27.22,
      "lon": 77.49,
      "weight": 0.9988
    },
    {
      "type": "fraud_ring",
      "district": "Deoghar",
      "lat": 24.48,
      "lon": 86.7,
      "weight": 0.9944
    },
    {
      "type": "fraud_ring",
      "district": "Jamtara",
      "lat": 23.79,
      "lon": 86.8,
      "weight": 0.9998
    },
    {
      "type": "fraud_ring",
      "district": "Chennai Central",
      "lat": 13.08,
      "lon": 80.27,
      "weight": 0.9971
    },
    {
      "type": "fraud_ring",
      "district": "Jamtara",
      "lat": 23.79,
      "lon": 86.8,
      "weight": 0.9994
    },
    {
      "type": "fraud_ring",
      "district": "Jamtara",
      "lat": 23.79,
      "lon": 86.8,
      "weight": 0.9994
    }
  ],
  "audit_trail": {
    "model": "groq/llama-3.3-70b-versatile+prompt-v1.0",
    "inputs_hash": "c771971ed82fe00d",
    "prompt_version": "1.0"
  }
}